{"schema_version":"0.6","baseline_topology_sha256":"6666666666666666666666666666666666666666666666666666666666666666","candidate_topology_sha256":"7777777777777777777777777777777777777777777777777777777777777777","experiment_sha256":"1234567890abcdef1234567890abcdef1234567890abcdef1234567890abcdef","analysis_kind":"controlled_ablation","topology_dependent":true,"metrics":{"investigation_quality":{"applicability":"applicable","value":0.74,"reason_code":null},"coordination_overhead":{"applicability":"applicable","value":0.18,"reason_code":null},"role_contribution":{"applicability":"unavailable","value":null,"reason_code":"insufficient_controlled_samples"}},"limitations":["experimental_topology_dependent"]}
